gif_url;gif_caption;model_caption
https://38.media.tumblr.com/9f6c25cc350f12aa74a7dc386a5c4985/tumblr_mevmyaKtDf1rgvhr8o1_500.gif;a man is glaring, and someone with sunglasses appears.; the face of a man in a black hooded mask with a black suit
https://38.media.tumblr.com/9ead028ef62004ef6ac2b92e52edd210/tumblr_nok4eeONTv1s2yegdo1_400.gif;a cat tries to catch a mouse on a tablet; the cat playing with a tablet computer.
https://38.media.tumblr.com/9f43dc410be85b1159d1f42663d811d7/tumblr_mllh01J96X1s9npefo1_250.gif;a man dressed in red is dancing.; a hip hop group in the early 90s.
https://38.media.tumblr.com/9f659499c8754e40cf3f7ac21d08dae6/tumblr_nqlr0rn8ox1r2r0koo1_400.gif;an animal comes close to another in the jungle;the gorilla is the king of the jungle - the most dangerous animal in the
https://38.media.tumblr.com/9ed1c99afa7d71411884101cb054f35f/tumblr_mvtuwlhSkE1qbnleeo1_500.gif;a man in a hat adjusts his tie and makes a weird face.; the best of the best movies of the 1930s and 1940s.
https://38.media.tumblr.com/9e437d26769cb2ac4217df14dbb20034/tumblr_npw7v7W07C1tmj047o1_250.gif;someone puts a cat on wrapping paper then wraps it up and puts on a bow; a cat gets a gift from his owner for christmas.
https://38.media.tumblr.com/9e4ab65c0e7d4bb8aa6b5be854b83794/tumblr_mdlv9v6hE91qanrf2o1_r11_500.gif;a brunette woman is looking at the man; the most beautiful woman in the world.
https://38.media.tumblr.com/9ecd3483028290171dcb5e920ff4e3bb/tumblr_nkcmeflaVj1u26rdio1_500.gif;a man on a bicycle is jumping over a fence.; a man on a man on a bike rides through the city on a skate
https://38.media.tumblr.com/9f83754d20ce882224ae3392a8372ee8/tumblr_mkwd0y8Poo1qlnbq8o1_400.gif;a group of men are standing and staring in the same direction.; the players pose for the camera with the team in a group photo for the
https://38.media.tumblr.com/9f4cb2977d5cd905f57293ac506b9db8/tumblr_msij5q4Run1qd76t9o1_500.gif;a man with black clothes is dancing sexy; the man in a suit and tie dances on the stage in a black and
https://38.media.tumblr.com/9e6fcb37722bf01996209bdf76708559/tumblr_np9xo74UgD1ux4g5vo1_250.gif;a boy is happy parking and see another boy; a boy with a smile on his face and a guitar in a t -
https://38.media.tumblr.com/881302bfd0245614cb165636887cfed6/tumblr_noncfelojf1uqmy01o1_500.gif;a man winks, and a man with a fork motions him to be quiet.; i love the way he looks at the camera with that smirk on his
https://38.media.tumblr.com/886236e83a1a1b6ae9f4dc43509f2fe6/tumblr_nov5tja4g91rkmzrjo1_400.gif;a man walks into a room and sees a girl floating above the bed; a ghostly figure appears in the window of a room in a haunted house
https://38.media.tumblr.com/88817768f0c3b54c7a1b58908037ca1f/tumblr_nq7f66LEk41tzifluo1_400.gif;the vehicle is moving fast into the tunnel; a car driving through a tunnel in the mountains.
https://38.media.tumblr.com/88de8efed91578715420f8a93c5e3da6/tumblr_nq3ofebQo51s4vpwjo1_500.gif;a beatles show, paul is on the front singing very enthusiastically;psychedelic rock artist, the band performing live on stage with their instruments
https://38.media.tumblr.com/8952c98f05a5f01377ac98c041cfe63e/tumblr_nqofwqgS8d1siem3jo1_r1_400.gif;a sport car is swinging on the race playground; the car was driving at the race, which is a modified version of a
https://38.media.tumblr.com/881416379772a539d5bb311c5bab9cd9/tumblr_nmzcu205yo1qdj2qoo1_500.gif;a woman is laughing and holding a man, the man is not laughing; the actor and actor in a scene from the film.
https://38.media.tumblr.com/88bd6013c943b41c93f685e0577b451c/tumblr_noxbsuCyAg1tjhed2o1_500.gif;a man with lights on his jacket watching a large screen tv; the lights go out in the dark.
https://38.media.tumblr.com/8911141195ce21e492761edba81ef309/tumblr_n4hv5jJDcS1t96jpzo1_500.gif;a gloved hand opens to reveal a golden ring.;the ring of the ring of the lord of the ring trilogy.
https://38.media.tumblr.com/88091baac04b18ef73d93e56883dccfe/tumblr_npzfsr13I51uyqfd5o1_500.gif;a skate boarder is doing trick on his skate board.; skateboarder in the skateboarder jumps over a rail and lands on
https://38.media.tumblr.com/89160d6633d04d4a9c8e7c8085f1c74d/tumblr_nqmgdj8STn1rn1g1jo1_250.gif;young man is clapping with his hand and dancing;i love the way he looks in this picture.
https://38.media.tumblr.com/8852d21ad80d138416453eb968ee97bc/tumblr_npntschfQp1qf69tyo1_500.gif;a guy are kissing a girl slowly in a swimming pool.;i love you, but you're not the only one for me.
https://38.media.tumblr.com/88976e0d8b0e068ebdb114ad9226b66a/tumblr_nmp0m0o3Iv1r44r7zo1_500.gif;the clouds are moving next to the full moon;the moon in the sky at night time.
https://38.media.tumblr.com/8f5d9f86ebefa35baeadaba5337d09fc/tumblr_nox28g9fv41tfkobto1_500.gif;a man and woman is making out in the shower; i love this kiss from the movie, i love this kiss from the movie
https://38.media.tumblr.com/90a1a65d2e1608451e84e2fe4bd16d04/tumblr_npse2pIimv1tyncywo1_400.gif;a wet cat in the bathtub tries to get out.; cat in a bathtub of water, but not a drop of water in
https://38.media.tumblr.com/902d6ba5bec4cf7a593cdc111fa88f6a/tumblr_n0lv33BBrb1rc0kvpo1_r1_250.gif;four people dressed as squirrels are dancing in the woods; the animals of the animal kingdom are dancing to the music of the film.
https://38.media.tumblr.com/8f8d0f7a02f4ade5527ffd63ee9883fd/tumblr_np2k4xqcDt1s9b6vho1_500.gif;a drummer is beating the drum with lightening fast speed.;the band performing on stage in concert in concert.
https://38.media.tumblr.com/909c68e83bf7299c07c53753b7f57366/tumblr_nntpx3AxcV1tyncywo1_500.gif;a sugar glider jumps off a belt on the wall; a man in a room with a cat and a dog, and a man
https://38.media.tumblr.com/8f7fabf26213fb6a683419f5a48d326d/tumblr_no5kyk0Mgs1urjsaqo1_400.gif;some zombie are attacking a read head woman,;the scene of the movie, the scene where the monster is seen for the
https://38.media.tumblr.com/8fd8930ec4e3458c1e616d6002e6a53f/tumblr_nqq3ibcw841rvg72ao1_400.gif;a cat magically moves away from a man's food.; cat in a box of cat food on the floor of the kitchen.
https://38.media.tumblr.com/8f976a0c90d91d940223d3a76de5006e/tumblr_mudwwxBWdn1qm26qzo1_500.gif;a man smiles and laughs into the microphone.;the actor on the set of the actor on the set of the film -
https://38.media.tumblr.com/8f6110a0ec6a7409579b878ba09ae62f/tumblr_nq07jm1AQ51sja1kdo1_500.gif;a bald man drop one bomb and explode the local; the most dangerous man in the world.
https://38.media.tumblr.com/902f71ae45f50dc0a35c04323de6495a/tumblr_nj4iqcVaFQ1s26nzro1_500.gif;a man are holding a bottle taps it on his head.;i love this guy.
https://38.media.tumblr.com/900fe9102f650f3277c7c3d57ea095bb/tumblr_npo3mtQ87f1uxcyego1_400.gif;a boy are talking to another boy with an open door.; the man and the girl are in a room and the girl is looking at
https://38.media.tumblr.com/901288b4a1c66c58571245623bca46f9/tumblr_nqexpu1pOL1sqicm1o1_500.gif;a woman trying to control her dragon.; the dragon is the most powerful of the dragons.
https://38.media.tumblr.com/8f53c46d4e2a40bc8dfc458fbd145cf1/tumblr_nq541zHa5n1uy63pco1_r1_250.gif;the singer and artist are taking a look forward.;pop artist on stage at the music video for her new single is a visual
https://38.media.tumblr.com/8fb23a0c630d559029d1ed77a9a5959e/tumblr_nnxshbEKOc1rqd7uco1_500.gif;a man is wearing a cap and headphones making hand gestures in front of a microphone.; a man in a hoodie and a baseball cap is singing in a studio
https://38.media.tumblr.com/8f5884647e1aaa0bda5677fbefec7ed4/tumblr_nq8ajiaBT71usj03ho1_500.gif;a couple standing in the sea embrace each other.; a man and woman in a boat on the water at sunset.
https://38.media.tumblr.com/8bf7c993adf5ba5ecea8ed946f8eb10e/tumblr_np5x4gNc1L1ux4ymjo1_500.gif;a couple plays with each other's hair.; i love this is the most romantic thing i have ever seen in my life
https://38.media.tumblr.com/8c4ee5c0338ad534042e85605b70c927/tumblr_npqraj6f5R1uuxd1yo1_500.gif;a man looking down looks up and speaks to his reflection; i love the way he looks at the girl in the first episode.
https://38.media.tumblr.com/8b67dd69640e5b12d55fdd8257319782/tumblr_no2up3t1Bv1usegjto1_250.gif;a man swing with his knife and destroy everything; the ballroom dance scene from the ballroom dance in the episode of the
https://38.media.tumblr.com/8c90113076757a48a25a53942d829b02/tumblr_nl77cuGZWn1sm50zqo1_400.gif;a woman is talking and holding a tea towel.;actor in a scene from the film's first film, a film released
https://38.media.tumblr.com/8beac80e7df8b66fc5d50d9f0679c527/tumblr_nnn5873T0c1uqclqmo1_500.gif;a girl is smoking with his friend in the house; a man with a black and white photo of a person in a dark room
https://38.media.tumblr.com/8bf3197a0c9d0218d2fef5b428d2c143/tumblr_nowg4sfk6D1qzefc2o1_400.gif;a woman in a blue shirt moved forwards.; a team of people working on a computer in a room with a large screen
https://38.media.tumblr.com/8b7e9aa41d080e9141a6f32fa4e7bbdc/tumblr_nohp6gAaLv1si7d5lo1_400.gif;a good looking guy in black is pouting.; i's a man who can make me laugh until i cry.
https://38.media.tumblr.com/8cd34a2a68232f097b85f1839a2fd7a3/tumblr_npgxznNRd31uv0y2ro1_250.gif;a cute little bulldog puppy is taking his tongue out.; dog is a dog that loves to play with his owner and give kisses to
https://38.media.tumblr.com/8cd949e726a9ec15950a4f4cda4eb330/tumblr_nq789eiheZ1r3kmkso1_1280.gif;a man smells coffee in a brown bag.; man in a cafe owner is pouring coffee into a cup of coffee in a
https://38.media.tumblr.com/8c572ffffaad8065e52d3235bd0146b5/tumblr_nqrlhsLD931uzihc0o1_500.gif;a person is kissing another person with heavy makeup.; the kiss of a kiss of a lover's mouth on your neck,
https://38.media.tumblr.com/8cc0d8b94f1694a74f8754de3934ae2d/tumblr_nqir72vsUx1sd7dido1_500.gif;a guy is making a few turns in a throne and then points a gun.; the king of hip hop music video artist in a hoodie and a crown
https://38.media.tumblr.com/8bb63b757c40c499d2eccb9a2910d57b/tumblr_mgq9bwHRA51rhzq0oo1_500.gif;a shirtless man with tattoos turns around.; a man with a tattoo on his arm.
https://38.media.tumblr.com/8b8c94e0279cc6d2775ae08e0853f823/tumblr_nq5nstjatI1u1lytfo1_250.gif;smoke is coming out of some log burning near some building.; the fire is extinguished by the fire is extinguished by the fire brigade.
https://38.media.tumblr.com/8c14aa571911985d6d774762f8159452/tumblr_n4gk7efcMw1spy7ono1_400.gif;the tiger is running really fast in the garden; a dog jumps into a pool of water and gets stuck in the water.
https://38.media.tumblr.com/8cd3ac9b6db79b6fb1f52961bb173276/tumblr_nogx44forU1swlz57o1_500.gif;a man are sticking out his tongue and shaking his head; a man in a world of the future, a man with a smile on
https://38.media.tumblr.com/70f4c1fc63e69bafb2c0aafcc293d6ff/tumblr_npc3iyfpDC1ux3xido1_400.gif;a girl in a football uniform is dancing and singing; the players of the team are all smiles as they celebrate after winning the game
https://38.media.tumblr.com/70f2b88e7ef089a5d8d3722dfceb1e55/tumblr_n8tb4xoSOr1sxfqdyo1_1280.gif;the roof down and cut the boy's body; a man is walking on the street and sees a woman walking on the street
https://38.media.tumblr.com/6f8901961aa2ff3f85a105e844ced445/tumblr_nq2px77Scz1uycuzco1_500.gif;a young person are wearing a bikini and helmet running down a corridor; the cast of the film on the set of the film.
https://38.media.tumblr.com/70af581598a20a1af31773cdab4b0321/tumblr_mxp686hce71sqec3to1_500.gif;a man and woman are hugging in a shower.;a couple in a shower together in a shower.
https://38.media.tumblr.com/6ff9ef1e816fed43fcf7e2f2498e1349/tumblr_nl33vmyhNi1u9vl8lo1_400.gif;two guys are laughing and one falls down to the floor.; the best moments in the life of a man who was given a glass of
https://38.media.tumblr.com/712368408b70ce32ee4eb0f9f6fe6639/tumblr_noxlpdet5k1uwrtyko1_500.gif;a woman is touching a colored object with her finger.; a girl is trapped in a room with a monster in the movie's
https://38.media.tumblr.com/709628e0cae3704db3eae23d10695d67/tumblr_nntf25N0Fx1uu6kufo1_250.gif;a woman dances are holding a large pink ball.; a girl in a dress made of balloons.
https://38.media.tumblr.com/708a8a33362c8b2548c5b9a09463da49/tumblr_mtbdvn6y1D1rjj5sho1_400.gif;a young, shirtless man is giving the rock and roll symbol with his hands.;man in a black leather jacket and jeans with a black t - shirt and
https://38.media.tumblr.com/6fb91b85be51fd128be592d4618b6cf7/tumblr_noco9fFCqL1rpe4qfo1_500.gif;a man with longish hair laughs then puts his head down.;person in a black and white photo of person in a black and white photo
https://38.media.tumblr.com/7043680fa969949ff4ca0bf5fd9f64a1/tumblr_nnkjulMoHH1qfgmtoo1_500.gif;a woman is standing behind a microphone and is running her fingers through her hair.;she is a pop artist and she is wearing a black dress with a black
https://38.media.tumblr.com/646593e337829d1ec07c41f628fbf431/tumblr_nju2re8NaP1ssgr2ko1_500.gif;a woman has a conversation with a girl; the best thing in the world is a smile from the person who is the
https://38.media.tumblr.com/64d21677dbcd80a0b1c83082817d9bb3/tumblr_noish93cHw1u4k0zeo1_500.gif;a person with white hair is opening his mouth, there is smoke coming from bellow;the most beautiful person in the world.
https://38.media.tumblr.com/643522422670f705610510e57907fbec/tumblr_nqqpgscLkK1urwkppo1_400.gif;a woman blinks and jerks forward looking surprised.;the most popular tv show of the year is back with a new episode and
https://38.media.tumblr.com/63bb0d748426c9cfb111917d2b8836d6/tumblr_mxtfcmpXuH1qgzzafo1_500.gif;a woman is posing to what appears to be a modeling photo shoot; the model wears a black dress with a black dress with a plunging neck
https://38.media.tumblr.com/6421efefaae5fd090d75fd2b98d1382e/tumblr_ne86njGv9l1trq9l0o1_500.gif;two boys walk down a hallway and look angry;pop artist in a suit and tie with a guitar in the video for his
https://38.media.tumblr.com/6453cb7a476ce87f7abcfb7149b171bd/tumblr_nqgz75OOEB1snj1pfo1_500.gif;a man is walking in a crowd in the dark.; the rapper performs at a concert at the event, which was held at the
https://38.media.tumblr.com/64ccc75d23cf6a8a3a43f32988991bb6/tumblr_nonwd4NsEu1qhyoyno1_250.gif;A man and a woman stare into each other's eyes and talk; the person in a romantic comedy film about a man and woman who meet and
https://38.media.tumblr.com/6483c631effcc53025204ae6b66ffd3e/tumblr_noyw22UY4p1qax7m1o1_400.gif;a man with glasses are staring at something.; a man in a suit and tie and glasses is a man in a suit
https://38.media.tumblr.com/64a238fc39c8ee1d313e40ffa48cda10/tumblr_npwndlNfA31unrb56o1_400.gif;a car drives through a puddle and drenches people at a bus stop.; a bus driver is seen trying to stop a bus from sliding into a ditch
https://38.media.tumblr.com/832c81c5fd750a6e2ad47d6f99d5c32c/tumblr_nonrseS1vL1sjsqcyo1_500.gif;a woman is smoking while another woman is touching the hair of the woman who is smoking.; the best friends are the best friends in the world, a group of girls
https://38.media.tumblr.com/813707bd10cda80f211f178dd254f234/tumblr_nlbv8s8oKn1rkvwppo1_500.gif;a person makes a figure with his hand in a mirror;the heart is a window to the soul, a window to the past,
https://38.media.tumblr.com/81fb51d8e89a8af3bc0cd8396711281d/tumblr_nl2atgmJOt1tam15wo1_500.gif;the girl with the glasses and jacket is jumping; in a dress with a beautiful girl in a dress with a crown on her
https://38.media.tumblr.com/80f4f7bcf1ccf55b56a790f358da0a5f/tumblr_nkymseZ2UC1u4gszco1_400.gif;a man is sitting on a sofa beside three others and is throwing a drumstick on the floor.;the band members of the band in the studio with the band in the video
https://38.media.tumblr.com/81ee9eb0f2fe73e68153c8aa0e9e0c61/tumblr_n0aovd6keZ1sgtd4uo1_500.gif;a man with microphone falls back into crowd.; the lead singer of the band performing on stage at the festival.
https://38.media.tumblr.com/81c408ac0a101d90c548284655f22c41/tumblr_notdrxYMLZ1uwsm9to1_400.gif;a man riding on some drum and beating it and singing.; the music video for the song by artist on the album love is a lie
https://38.media.tumblr.com/8178f0c2ddf9d898b697e1f9738b3ec2/tumblr_npuokpnu8f1szd8auo1_400.gif;a man with is shaking his hands up and down.;s video shows a man dancing to the music of the same name in a
https://38.media.tumblr.com/8280fface19efac034d699ce72d8cbfe/tumblr_nq3arkKkE41utbf1ao1_500.gif;a girl who has a pink hat and clothes are smiling.; a little girl in a cute little girl in a cute little outfit.
https://38.media.tumblr.com/813610370f0da5aff754a73d3cf4d973/tumblr_nq0ki6PRbw1tqvovno1_400.gif;two feet with painted nails is wearing high-heeled sandals.;the shoes of a man's feet are illuminated by the light of a
https://38.media.tumblr.com/819a74539497ae1899be30977054ea8e/tumblr_np541orFHz1uwafnqo1_400.gif;a man are doing acrobatic stunts on the wing of a plane.; a man jumps off a plane and lands on a parachute.
https://38.media.tumblr.com/81976ab164f44c6d4a5df1e567a7a41f/tumblr_npx4q3yGPC1thfk1ho1_250.gif;a man in a suit is talking on a cell phone.; the actor in a suit and tie and a tie in the tv series.
https://38.media.tumblr.com/a8202ac881bda3a893dc06329d797230/tumblr_nqc68gfjSw1uxae7wo1_400.gif;a girl are taking the laundry down on a windy day.; the ghost of a man in a white sheet in a haunted house in the
https://38.media.tumblr.com/a750d8b2acaa32e6112665a939e886c2/tumblr_nqjagbJPI91sygccjo1_540.gif;two boys are walking, the one in the front licks his finger.;the singer is seen in the video with a black jacket and a white shirt
https://38.media.tumblr.com/a75f5635241378daa25adf26b6badf05/tumblr_nq90j9QffG1ux81poo1_500.gif;a woman is smoothing her hair, and does various poses.; the most beautiful girl in the world - a portrait of a girl with a
https://38.media.tumblr.com/a6a2f2c7bb44565ddd093676807ac8d9/tumblr_no5j5oD1q21ri61l0o1_400.gif;a skateboarder doing a trick inside a drained pool; a skateboarder gets a skateboarder to the face with a huge
https://38.media.tumblr.com/a73a6a3c2667bb7a0bbbe9854c4f5d86/tumblr_ni2l89yZ7r1u4o6i5o1_500.gif;a boy and a girl are walking down hand in hand.; the couple's hands are holding hands in the rain.
https://38.media.tumblr.com/a72891929bfbf6683c4b6f81b6bd4b3c/tumblr_mvuy2hVOOD1rngmtco1_500.gif;a lot of pines are crossing along a side of a road.; a forest in the forest in the mountains.
https://38.media.tumblr.com/a7fe1e1d1525d13775042c4f4d480f6a/tumblr_npybchwzUr1ri61l0o1_400.gif;a skateboarder jumps onto and off a stone platform.; a skateboarder in the city skateboarder is a pro skater
https://38.media.tumblr.com/a53426f2be652304a6cf1857c7dca052/tumblr_np5aw09Aa31shzpsuo1_500.gif;a girl in black dress is walking in slow motion.; a model in a black dress with a black dress and a black tux
https://38.media.tumblr.com/a4f761492781f2985c9b470f3764ee87/tumblr_mppeopxznZ1rku4s3o1_500.gif;an asian man is talking in front of a microphone.; a photo of a photo of a person in a room with a computer and
https://38.media.tumblr.com/a5f27adf06dac45af78b4976707a2f55/tumblr_mrmmwo38f01qc03ipo1_250.gif;a guy makes a funny face and raises his eyebrows while putting on sunglasses; i a man with a look of shock on his face as he watches tv
https://38.media.tumblr.com/a54f528e0dc20af6982a459d788cd477/tumblr_not9zcAaHu1uvzbfuo1_400.gif;a guy are talking and touching his hair.; i's face when he's just so cute.
https://38.media.tumblr.com/a614a76688228eb82c5879850d8fffe5/tumblr_nohs96BXF91u9mqd6o1_400.gif;a red dinosaur costume tripped on the gym floor.;the mascot is a bear in a red and white costume with a red and
https://38.media.tumblr.com/a529f7267f796ebd64a579a303194858/tumblr_nq77k6nh6H1tn6vtbo1_500.gif;a boy are running and jumping over a ball.; a man in a red hoodie is seen running away from a man with
https://38.media.tumblr.com/a5ae5a1270a7246170b15e86a8723348/tumblr_nppe4itAAr1sz4xdoo1_500.gif;a man with a black hat is walking in the rain and he looks angry.;a man in a black and white film directed by director.
https://38.media.tumblr.com/a52888989b59a45aba7ba81e2c22bb9c/tumblr_npx2d96ZLV1uuyoqfo1_500.gif;a girl is doing hanging push ups in a gym.; a black and white shot of a woman doing a backbend in a
https://38.media.tumblr.com/a5bbe3fbabae73d54d80364c2dc845f6/tumblr_npm622Izam1rx8qjfo1_400.gif;a young white boy in white shirt is brushing his hair; the most attractive man in the world is a little bit of a nerd.
https://38.media.tumblr.com/a56359972856860dae178804cf85e363/tumblr_no22jv00hd1th31wno2_400.gif;a man stares blankly while another man moves in double exposure.; a man in a man with a beard and a beard is a man with
https://38.media.tumblr.com/a545ea6bd45afcf422e28070ff26db59/tumblr_nnxz08i1sa1uoynh5o1_500.gif;a man dives from a cliff into the sea; the best dive of my life! [RET]  underwater footage of a diver jumping off
https://38.media.tumblr.com/a6418c7e149962c6330c425866a22a44/tumblr_mpehmq9Xmk1s6our6o1_500.gif;a man is speaking with someone and smiling.;person, the actor who played the character in the tv series, person,
https://38.media.tumblr.com/b1fdd23b1bb5f47b597b1b4ebb15b137/tumblr_nqaoo8yMNY1uxae7wo1_500.gif;a dark figure is appearing and disappearing on some kind of visual recording.; the hallway in the haunted house in the dark.
https://38.media.tumblr.com/b2ce5f54a11e8aec0c32a4cbb691ebd0/tumblr_no3inlKHGv1smv1p3o1_400.gif;a man are holding a sparkly ornament on his arm.; the rapper's hands are covered in gold chains and rings.
https://38.media.tumblr.com/b1bcf68a98567753a9ddfe5b20600d9a/tumblr_npbyvpJ3V31us4t6to1_500.gif;a woman is eating while looking angry.; girl in a girl with a beautiful smile and a beautiful smile.
https://38.media.tumblr.com/b312c5dc018fde65132e221003c9b842/tumblr_npjdz5Rgcs1u8gd00o1_500.gif;a performer slides his hand up his thigh at a concert while gritting his teeth.;he's got a lot of tattoos on his arms and legs.
https://38.media.tumblr.com/b324f389754052c872ba05970687e144/tumblr_nprx63hci41tlpnk6o1_400.gif;the boy in the brown shirt is jumping behind; a man falls down a flight of stairs and lands on his face.
https://38.media.tumblr.com/b27e943b5267ca7b4323907f02fcb747/tumblr_mkn76n09cL1ryp9xpo1_500.gif;man is raising his head looking straight ahead.;i love this guy.
https://38.media.tumblr.com/b25ee6fcdac2374b4c43e9ce4e182894/tumblr_nok8y9MLT31rhpks2o1_400.gif;a woman is wearing a white hooded jacket and singing in a snow flurry; : the video for pop artist's song is a visual representation of the
https://38.media.tumblr.com/b2e13d4a922d13fa85f43534e805527f/tumblr_nqdvrm7GWA1uv0y2ro1_250.gif;a brown and white dog jumps up and down while waiting for food; a dog that loves to eat the food off the floor.
https://38.media.tumblr.com/b393636ae6bebf36c16ecb5f2edad529/tumblr_nqm7awU7le1s24u17o1_400.gif;a man in a black hat and flannel shirt dances by spinning around with his arms outstretched.;s best known for his performance in the music video for his song, and
https://38.media.tumblr.com/b33c952a92d43aa453504c1224e2a4cd/tumblr_nqg45uhhWb1sawo9uo1_500.gif;a sad woman in a veil bows her head on a cloudy and windy day.; a dark and gloomy scene with a woman in a white dress and a crown
https://38.media.tumblr.com/b28c1fb0e83d5412b13c4bae843a8c32/tumblr_npirbiumEa1u8gd00o1_250.gif;a man and a boy with microphones move across a stage.;he was a little bit of a rock star in the background of the video
https://38.media.tumblr.com/b382fe09e7fc7a5bea58e1d55a57604b/tumblr_nq3aq9bccT1uv0y2ro1_250.gif;a hand reaches out to feed a chinchilla and it snatches the food and retreats into a hole.; a baby animal is seen in a cage at the zoo, which is home
https://38.media.tumblr.com/b3f0ecf4f35104a58540895fb10110aa/tumblr_nq0d5lzqtA1uw1s13o1_400.gif;a woman pulls her hair back into a pony tail; person in the film - the most beautiful woman in the world - in the
https://38.media.tumblr.com/b34dfe94eba2677c09f8107cd822db3b/tumblr_npswzuXNTP1tk15f6o1_400.gif;a girl in a white dress is walking in the snow; a man in a black and white film in the snow.
https://38.media.tumblr.com/b3256b0d2904747da75bd7cdf8db0736/tumblr_np387iDhn91sbfmpio1_500.gif;a man with a microphone and hat runs forwards.;hip hop artist performs on stage during a concert.
https://38.media.tumblr.com/7ccffd805178e088d64609dee5f5a341/tumblr_nptde5xU591uy9f1io1_250.gif;it is a boy and girl singing during a concert.; pop artist and pop artist perform onstage at the pop artist tour in concert.
https://38.media.tumblr.com/7bf8d434fb6b7be78eafa716df327709/tumblr_no0sq6QbP81tyshtmo1_400.gif;the man on myth busters does a dance by a target.; the best way to get the perfect shot with a dart.
https://38.media.tumblr.com/7cf91f55be26ad58d38a8cba3a316f83/tumblr_nqjzda6yEs1ur30hlo1_500.gif;a bear climbs the ladder of a swimming pool and jumps into it;s most popular dog in the world is back in the water after a fall
